,title,body,rating,product
0,Super comfortable and long lasting mouse,"Bought this mouse after a long research so writing here my review after 2 years of usage.For those complaining aboit long keys and uncomfortable usage, let me tell you this is complete mouse and not mice so you need to understand difference. This is much more comfortable than mice if you work for long hours.Now coming to delivery. Amazon did great job in delivering super fast also deal on this mouse was an add on.Now coming to quality. This is heavy duty built mouse for longer run. Working like charm even after 2 years of usage. I have tried several different brands like Logitech, HP, etc but no one stand near to this.Some others are complaining about very thin wire. Kimdly note there are several sellers on amazon so buy only from trusted sellers with higher ratings.With return policy available at amazon you can try it once based on my personal experience.You can ask freely whatever you want to ask regarding buying through direct message in my profile and If you found this helpful give a thumbs up",5.0,Dell MS116 1000DPI USB Wired Optical Mouse
1,Contry of origin is china,I specifically ordered this item because it said country of origin is India. When I open the box it said maid in China. Why are you misleading the people by false advertising?,1.0,Dell MS116 1000DPI USB Wired Optical Mouse
2,Simple and good,"Moved back to a wire mouse, as my wireless optical logitech mouse started giving problems,, anyways i am happy with this, as i dont have to bother about battery,, and it seems nice and rugged..",5.0,Dell MS116 1000DPI USB Wired Optical Mouse
3,Amazon hiding country of origin of items from customers.,This is Chinese product. Amazon conceals country of manufacture of the product before choosing a product from the customer. Quality standards differ from country to country and Amazon is violating consumer rights.,1.0,Dell MS116 1000DPI USB Wired Optical Mouse
4,Genuine Dell mouse,"Its an excellent mouse in this price range. Original genuine product with warranty card and online verify card. The packaging is excellent with lot of tamper evident seals so you can assure that the product you received is authentic and unused one.Some of the pros include,~Black matte finish body with no annoying paint brand logo on top and button so no reflections nor paint washout on usage.~Cable length and mouse size in medium range so suitable for most and can be used for both desktop and laptop.~Under the mouse the stand feet is curved continuous one made from same plastic and thus less chance to accumulate dirt.~cursor moves very fast and accurate, no false moves.Some of the cons include these~Scroll wheel is not friction less instead step based so some sound and resistance there when scrolling.~Click sound there but a pleasant one similar like keyboard key press sound.But these cons will not be problem for many considering its performance and accuracy.Reducing 1 star due to step based scroll wheel which is bit hard to use especially when scrolling to top.Overall an excellent general purpose mouse!",4.0,Dell MS116 1000DPI USB Wired Optical Mouse
5,Not working,"I buy this product from amazon after 15 days it's not working. Communicate with amazon customers care they told me to call Dell customer care. And they reply me to call me after 2,3 days. This is happening again and again.",1.0,Dell MS116 1000DPI USB Wired Optical Mouse
6,Most Affordable & durable mouse ever in this price category,"Giving my review after 2 years of usage.I plan to purchase it again after 1 or 2 months, since it is wearing off due to gaming.I use it for all day-to-day tasks (including Gaming, mostly CS:GO). I know it's not a gaming mouse, but I don't have a gaming PC, so it doesn't matter. You can at least reach till the ranks of Gold Nova Master using this mouse in CS.PROs :-1. Simple in design and looks.2. Perfect for small and medium-sized palm.3. It's quite durable/long-lasting. If you use it for normal tasks(not gaming), it can easily last for 3+ years.4. Good mouse for beginners in FPS Games.CONs:-1. There aren't any, considering it's price point.",4.0,Dell MS116 1000DPI USB Wired Optical Mouse
7,Dell MS116 1000DPI USB Wired Optical Mouse - I could sniff the quality 😊,"As a kid, I remember when my US-based relations used to bring me gifts from USA; these gifts had  a aroma to them - a kind of strong sterile aroma. When I opened the Dell Mouse package, I got the same aroma and of course, the mouse worked amazingly well - unlike the new Genius mouse that barely worked for two weeks before scroll wheel failed.This Dell Mouse has a Usb cable and is a plug-and-play device. It's speed, scroll speed etc can all be controlled from the Windows Control Panel. It is Ergonomic, smooth, and easy to use.I'm using the product in an office environment. As for gaming, I think this might not be a suitable device because the right and left click buttons are a bit 'heavy' i.e requires a bit extra pressure for the click. So, it is excellent for office and regular work but not for gaming.",5.0,Dell MS116 1000DPI USB Wired Optical Mouse
8,"Great brands, great service","A simple basic wired optical mouse. Specifically brought a Dell branded product for my Dell desktop. Stopped working within 1 1/2 months. The return window had closed on Amazon, however I called up their customer service and explained the problem. They immediately shared the Dell support hotline with me. On calling Dell, the support person asked me to perform some simple checks, take a few photos and email it to them. Within a few hours, they confirmed they would send a free replacement. And in less than 2 days thereafter, the replacement mouse arrived just as promised. For a mouse that costs less than Rs.300, this was truly delightful service. No wonder Dell is legendary for its support. Great brands are built on the foundation of great service.",5.0,Dell MS116 1000DPI USB Wired Optical Mouse
9,Second purchase I have done ... Last only 6 months,This is my second purchase of this mouse. The average life of this mouse is 6 to 8 months after which the left click starts to be recognised as a right click or the mouse scroll speed and the web portal scroll lags by a huge margin giving sub optimal performance of the web page being worked upon. The first 6 months will be awesome but after that it is a pain.,2.0,Dell MS116 1000DPI USB Wired Optical Mouse
10,Authentic dell mouse with 3 year warranty,I received the mouse sealed in an authentic dell box with dell sticker to scratch and check authenticity. I scanned the bar code and checked it's genuine. Also as per what's mentioned on box its 3 year warranty on this. Value for money for the price from a reliable brand dell.,5.0,Dell MS116 1000DPI USB Wired Optical Mouse
11,"Basic Build Quality and basic handling, not very ergonomic  & DPI sensitivity is good",Basic Build Quality if I compare to its older  model (harder plastic) and light in weight not very ergonomic if someone wants to do graphics work but good for basic handling & DPI sensitivity is good came with authentication card (very funny for a country which makes everything and copies of almost everything),3.0,Dell MS116 1000DPI USB Wired Optical Mouse
12,The mouse works well even on my shiny table surface,"The mouse works well even on my shiny table surface. The build quality is decent. I just hope the mouse shape was bit more ergonomic. The current shape is bit flat and doesn't have good feel in hand.But that is offset by the ability of the mouse to work on pretty much any surface. I had a HP mouse earlier in the same price range, but that required mouse pad if the surface was even a tiny bit shiny. But this Dell mouse works quite well and I think is worth buying",5.0,Dell MS116 1000DPI USB Wired Optical Mouse
13,Solid mouse,"It was a bit bigger than i expected so do check the dimensions properly before ordering but the size actually feels good on the fingers. It has long buttons and fits smoothly in the hand, although might take a bit of getting used to (esp if you use small mouses) i have no complaints regarding the build quality, its top-notch and worth the price. I bought it yesterday and have a feeling this will last long.",5.0,Dell MS116 1000DPI USB Wired Optical Mouse
14,Lightweight and Comfortable Mouse!,"I wanted to purchase a standard computer mouse with good good DPI for gaming and I came across this mouse.The top part of the mouse is matte black without any logo engraving thus giving it a clean and minimal look. The form factor is just the right size making it easy to hold, the tracking speed is also good for playing PC games.This mouse is an easy choice for anyone looking for a basic mouse with good looks, comfort and performance.",5.0,Dell MS116 1000DPI USB Wired Optical Mouse
15,Best one,"The best wired mouse I have ever used. It's really good, feels good in hand. For this price i think it the good one out there. Soft clicks, flexible grip and strong build. Packing is good from Dell. I have been using it for a couple of days and it's good but the final test will be in the long run. Have to see how it will do after a year or so.",5.0,Dell MS116 1000DPI USB Wired Optical Mouse
16,Best in the price.,I don't know why there are so many negative reviews. I ordered this mouse anyway and I'm very happy with it. It is easy to hold and light weight. Nice and clicky buttons and 1 year warranty too. It is better than HP's one in this range. I've used both.,5.0,Dell MS116 1000DPI USB Wired Optical Mouse
17,Left click a little slow response,I ordered the same model I had earlier. But this mouse button is not as responsive as the earlier one. I couldn't return it due to time it takes for a replacement and the covid issue dint allow me to go to near by store. So other issues with it though and packing was good. Only for the mouse click response I removed one star,4.0,Dell MS116 1000DPI USB Wired Optical Mouse
18,Country of origin Made in China,"It's origin country is China , not 🚫 India",1.0,Dell MS116 1000DPI USB Wired Optical Mouse
19,Very poor quality,"I have used up 4 of the 5 mouse/ mice I bought in less than 8 months.The right mouse button is the problem - stops working after a few days. In one case the scroll stopped. In 2 cases, the pointer, clicks- all were not working.Horrible.This is a particularly bad model- my exprience with other Dell models of mouse have not been bad",1.0,Dell MS116 1000DPI USB Wired Optical Mouse
20,Nice mouse with reasonable price.,"Nice option in this price. It does make good clicking sound, but i am fine with that.Light weight and good size for big size hand.Using it from 2 weeks and working nice till now.My usage is daily office, not gaming at all.I researched for more then 2 weeks and i was not able to jutify the cost of other expensive mouse. Mouse is like any other regular plastic, a small chip board and wire or may be wireless, how it can be 1k+.I",4.0,Dell MS116 1000DPI USB Wired Optical Mouse
21,Good mouse!,"It's good. Great mouse for office work, it's comfortable and easy to hold.As for gaming- the design is perfect for palm grip users, since it has a sloppy design. It's not really that great for me because I'm a claw grip user, but that's my personal issue so it doesn't matter here.I have always loved to game on office mice, since my hands are small-medium and I prefer light-weight mice. It's hard to find light-weight branded gaming mice at a reasonable price (according to an average middle class family).Anyways, it's good enough for casual gaming, definitely save up some money if you are going for pro gaming. I actually wanted to buy the Razer Viper Mini but it's currently out of my budget, guess next time. Corsair katar pro also seems like a good option for gaming.",4.0,Dell MS116 1000DPI USB Wired Optical Mouse
22,Don't buy ever!,"Really bad mouse from Dell. They just put the Dell logo on the mouse, and are fooling costomers that the mouse holds up to the quality of Dell laptops. The right key stopped registering clicks within a few months of usage. Warranty is a joke. Who is going to honour it? Go for Logitech mouse, they are quality and last long.",1.0,Dell MS116 1000DPI USB Wired Optical Mouse
23,Incorrect mention of country of origin,"From a product perspective, never have had any issues with any of the Dell products.. Only concern is don't mention incorrect country of origin.. It says India, however the product received is China.  I had asked for return/replace and got the same again.. (Made in China).. Not something that would appreciate..",1.0,Dell MS116 1000DPI USB Wired Optical Mouse
24,Precise movements Very good quality build No wonder Dell is the Best,"Buy without second thoughts.Don't buy those cheap Rs.150 mouse, buy this instead for Rs.299. It is worth every penny.This is 100 times better than Logitech M90.Precise movements of both the scroll wheel and the mouse cursor.Very good quality build.",5.0,Dell MS116 1000DPI USB Wired Optical Mouse
25,Nice for office work but a nono for gamers,"Hii if you read my review it means you look information which goes long story short as this mouse is a office mouse (i needed to scribble spread sheet) but as i was using some gaming mice too i got too many issues then i replaced it with a gaming mice namely logitech g102 (prodigy).So I will say if you have ever gone with ging mouse you will not like it, and if you just want a mouse which cost less than a cofeego for this its super cheap with max what you can get on this price.",3.0,Dell MS116 1000DPI USB Wired Optical Mouse
26,Nice looking and shape,"My 1st Dell mouse and I don't regret this purchase, very smooth and very comfortable to use, only cons is i paid 30 rs extra as i didn't buyed it during discount sale..",5.0,Dell MS116 1000DPI USB Wired Optical Mouse
27,"Great budget mouse! Been using for two years, and still running!","I'm writing this review after TWO YEARS of usage, and I got this in an discounted sale, for around 180 bucks that time :) A medium sized mouse that's good for large hands like mine! if u really want a mouse and you're under a TIGHT BUDGET, just go for this one, its an amazing and really LONG LASTING. Clean look, LIGHTWEIGHT, but yet plasticky, and click sounds are quite loud, scroll bar isnt so smooth, but under this budget, couldn't expect more and it really does the job, and I almost got used to all of the above mentioned cons eventually, and extremely surprised by its LONGEVITY, cuz generally mouses of this price didn't last long for me, not even a year, they stop working. But this isn't one of them. Pro tip, UNLESS AND UNTIL YOU HANDLE IT REALLY GOOD, AND HAVE THE PRACTICE OF KEEPIN IT PACKED OR BOXED IN A SAFE PLACE WHEN NOT IN USE, ANY MOUSE WOULD MALFUNCTION SOONER, just treat this mouse like any other mouse you'll get for thousands of bucks, it will last longer :) Great for PROFESSIONAL USE, video and photo editing, etc. Not so great for gaming, for playing games like Rainbow Six Seige, Valorant etc., due to less precision and response time(tested it, still you can manage to do well upto an extent, depends on how good of a gamer you are to understand and get used to the latency and response time of your mouse over time), but still you can obviously play some good old offline story mode games like GTA V. I'm a designer and I use it mostly for rendering, and modeling stuff, surprisingly this mouse seemed to do a great job for the price. Back then when I bought this, there were barely 100 reviews, and now I'm actually surprised to see these many reviews on this product. Overall, this is a really good budget mouse, and really really long lasting, as far as my experience at least.",5.0,Dell MS116 1000DPI USB Wired Optical Mouse
28,Go for it!,"I have been using it for more than a year now and I have no complaints whatsoever. I have taken care of it by not hitting it anywhere. So, I presume that's why it's working well so far.If the mouse you bought is having issues, then maybe there must be a manufacturing flaw or you must have hit the mouse somewhere or slammed it.But according to me, the product is great and can be used for long purpose.",5.0,Dell MS116 1000DPI USB Wired Optical Mouse
29,STOPPED WORKING AFTER 2 MONTHS,"As the subject states stopped working after 2 months, bought a Dell mouse thinking it would last longer than my tried and tested Logitech ones but sadly 2 months and it is dead. The logitech at least lasts for 2 years or more but sadly Dell does not believe in quality.",1.0,Dell MS116 1000DPI USB Wired Optical Mouse
30,Dell brand and Amazon experience.....Both are superb,"Well made a product unlike some other brand. It is a mouse which appears quite durable. It is the right size which will fit to all type of hands / fingers to operate. Operating for quite a period of time does not bother the wrist and to the fingers. An excellent choice for those, who are looking for a sturdy material for longivity of the product.Amazon delivery is excellent, and came with a proper packing with the original box packing from Dell.",5.0,Dell MS116 1000DPI USB Wired Optical Mouse
31,Not at all recommend,"This is poor quality mouse by dell, it worked fine during initial days but after a month left click is not working properly.I have to press it several time to work. Not at all recommended. I will try to get it replaced from dell as it is under warranty.",1.0,Dell MS116 1000DPI USB Wired Optical Mouse
32,Good mouse in cheap range,This mouse has been with me for more than 12 months now. I think this is the most amazing purchase I made when it comes to price to quality/performance.Mouse is well weighted for its price and has a quality sensor. which never skips. The ergonomics is pretty on point when it comes to priceOverall the Price is set at such a point that you cannot find a single flaw in it. and this is a much better buy then that HP X1000 mouse.,5.0,Dell MS116 1000DPI USB Wired Optical Mouse
33,First Day Experience went well. Will give brief later,Decent mouse at this price range ( RS 235). Delivered in 1 day thanks to Amazon. Will give a brief review after fair usage.Till now looks good feels good and also Good enough for medium hand people.Probably good for casual gaming. It's easy to hold not very short or too long.Overall good mouse at this price range.,5.0,Dell MS116 1000DPI USB Wired Optical Mouse
34,"Great, perfectly fine. No particular area where it is defective.","If you just need a mouse, this is the one for you. Perfectly fine for rpg and general games/gaming as well.Will also be possible to be used in FPS games, but that requires more debate.For FPS gaming, i.e., shooter games, e.g., pubg, valorant, csgo, battleground, fortnite, etc., this will require skill to master, a gaming mouse with the extra 2 buttons might be easier +they come with adjustable mouse speends, adjustable beyond the scope of the game/pc software.",5.0,Dell MS116 1000DPI USB Wired Optical Mouse
35,Basic mouse for regular use.,"Dell mouse for basic computer and office use. Standard,sturdy, ergonomic, big enough to be comfortable and reliable. Can game , but not all games because there are no extra buttons other than basic and cannot change dpi. I still play War Thunder with it.Again it is basic mouse. Reliability and ease of use is only expected from it and all others are bonus",5.0,Dell MS116 1000DPI USB Wired Optical Mouse
36,Budget pick,"works like a charm, very smooth response, flows over the display, great response time. Great fit in hand, decent size compared to other mouses in market which are smaller in size. Click buttons are very soft, like we don't have to really press them- they are that soft. I'm not sure how it responds in gaming because I'm not a gamer, but in daily duty it performs well.Its faster than my laptop touchpad. Wire length is also more than sufficient.Any other experience i will update here.",4.0,Dell MS116 1000DPI USB Wired Optical Mouse
37,Laptop mouse big size,This mouse comes under laptop mouse. But it is very big size and difficult to hold compared to a small mouse. They have given incorrect weight and dimension details. At one place they mention the weight as 413 gms another place 120 gms The l w h dimension in cm also do not.match. pls dont buy this mouse if you are looking for a small laptop mouse.,3.0,Dell MS116 1000DPI USB Wired Optical Mouse
38,Shaky mouse wheel,"Mouse is good to hold. But the mouse wheel is so loose and shaking too much sideways which irritates while using it to scroll. If you are a frequent user of the mouse wheel, you must avoid this product.Not sure how Dell has designed such a product. I was using a HP mouse earlier and its wheel used to be so smooth to use and scroll on pages.",2.0,Dell MS116 1000DPI USB Wired Optical Mouse
39,Not working properly,"Since day1 the middle roll is not good, sometimes stucks and very hard have to roll, very tiring. After 3 days of use it started to not move the cursor properly. Now its totally useless, and as i didn't expect it won't be good (I thought its Dell, must be good quality) I threw out the box and everything. Now I can not get a refund or replacement. Have to purchase a new one - definetely something else.",1.0,Dell MS116 1000DPI USB Wired Optical Mouse
40,Lightweight and smooth operation,"It has a basic design, and easy to hold.Installing the mouse was no issue just plug-and-play.The scroll wheel gives positive feedback while scrolling.Hoping the mouse lasts long trouble-free.",5.0,Dell MS116 1000DPI USB Wired Optical Mouse
41,This mouse didn't even last a year. Mice these ...,"This mouse didn't even last a year. Mice these days are a far cry from the solid, robust Logitech ones that used to last for years, just a few years ago.",2.0,Dell MS116 1000DPI USB Wired Optical Mouse
42,Average backup mice!,"You get only what you pay for. This mouse is made of cheap plastic. I should have checked the weight. It’s lesser weight that you can feel it’s inferior quality. No complains on the functionality. But the overall smoothness and clicks feels very inferior. That’s what you get for the price they charge. Overall I regret buying this, but will keep it as a backup if something goes wrong.",3.0,Dell MS116 1000DPI USB Wired Optical Mouse
43,Not an easy task to use this mouse.,"Since I'm using dell laptop so I prefer to use dell mouse, in 25 years I hv used many mouses, but this one sucks. While using left clicks (99% of clicking) your finger will feel pain because its poor design to hold your palm.",4.0,Dell MS116 1000DPI USB Wired Optical Mouse
44,Good mouse for large handed folks. Value for money.,Excellent mouse. Much bigger than the previous one I was using. I have large hands and this mouse is perfect.Also it's a USB mouse and much accurate than the wireless one I was using earlier.Very happy with it so far.,5.0,Dell MS116 1000DPI USB Wired Optical Mouse
45,Great product,It's a dell mouse. Amazing matt finish. Super smooth and comfortable for everyday office use. Love the feel if the product while using it. Super light weight. Long enough wire. Haven't used it for gaming. Value for money. Comes in the original box along with the waranty card. Great investment!,5.0,Dell MS116 1000DPI USB Wired Optical Mouse
46,The mouse gets stuck frequently,"I use the mouse mainly for excel and word. I find that it is unresponsive half the time and that it gets stuck. For eg. If I select an excel cell to changr the type to bold, the mouse insists on reviewing the formula instead and I have to delete the cell about 50% of the time. this should certainly not be an Amazon choice product!",2.0,Dell MS116 1000DPI USB Wired Optical Mouse
47,Fabulous,Awesome product. Its really fast and easy to use. cable length. Smooth and accurate cursor control at 1000 dpi. Just plug and play. Really comfortable. Good work Dell and Amazon.,5.0,Dell MS116 1000DPI USB Wired Optical Mouse
48,Good quality for the price,I was using the famous Logitech mouse before this and thought that this might be too small for my hand. But no! This mouse is of correct size for typical hand size and very nice to click and too good for basic usage and good for gaming as well. I have been using this for ~4 months now and I like it very much even more than the Logitech one.,5.0,Dell MS116 1000DPI USB Wired Optical Mouse
49,Dell Mouse - Review,"The media could not be loaded.
                




   When it comes to a brand like Dell, I don't have enough words. These products are great, durable, cost-effective and I'm sure they will last pretty long if you're using them carefully and professionally.",5.0,Dell MS116 1000DPI USB Wired Optical Mouse
50,Very soft clicks but it's awesome!,"The click is very soft. It should be a bit more deep so I know I clicked. Also the sound is very soft.The scroller is awesome. It's the best I've used and I know this is unbreakable. Every time I've changed my mouse, it was because of faulty scroll wheels.",4.0,Dell MS116 1000DPI USB Wired Optical Mouse
51,Great product at affordable price,"Decent product. Great to use for office or school or even at home. Quality of cables, USB jack and the buttons is good. Even after one month of continuous use (I use it for at least 9 hours every day) the sound of the click is the same as that of a brand new product. Can be used on any smooth surface. Optical detection is smooth as butter. Zero lag or overlap when using. I would highly recommend this product.",5.0,Dell MS116 1000DPI USB Wired Optical Mouse
