,title,body,rating,product
292,Good mouse in budget wont recommend for gaming,I thought it would be great for gaming particularly CSGO but not good for gaming overall its a good mouse for office use and day to day use,5.0,Dell MS116 1000DPI USB Wired Optical Mouse
293,in description it was made in US but when i saw the mouse it was china made,i liked the mouse it has a great sensor it has more sensitivity than by older mousebut i gave it 4 stars cuz its has a high clicking soundbut overall nice product by Dell,4.0,Dell MS116 1000DPI USB Wired Optical Mouse
294,Nice for office and who needed a long cable usb mouse.,Best .it have long cable too.and perfect.easy to hold and use.,5.0,Dell MS116 1000DPI USB Wired Optical Mouse
295,Ideal for WFH,Its very light weight and suits the purpose. Its been month and no click issue faced till now.,4.0,Dell MS116 1000DPI USB Wired Optical Mouse
296,Basic but Perfect!,"Simple and easy to use, budget friendly.",5.0,Dell MS116 1000DPI USB Wired Optical Mouse
297,Ergonomical. Elegant. Precise,Elegant. Precise and total value for money... the long length of the wire is the only hindrance for detail graphic work. But then all wired mouse have the same issue... worth the buy.,5.0,Dell MS116 1000DPI USB Wired Optical Mouse
298,best fit to the comfort,The ergonomics and the comfort of holding this is really awesome.,5.0,Dell MS116 1000DPI USB Wired Optical Mouse
299,One of the best mouse,Used for more than 6 months. Working best. No issues at all. Very good product in this range. Go for it,5.0,Dell MS116 1000DPI USB Wired Optical Mouse
300,Extremely happy!!,"This mouse fits almost accurately and comfortably in my bigger palm. Very easy to connect and to begin working. The click, though, makes somewhat High-pitched sound.",4.0,Dell MS116 1000DPI USB Wired Optical Mouse
301,Just go for it.,"My favourite mouse out there. Whichever ""gaming"" mouse can't beat it because it is in a league of it's own. Highly responsive and great to hold. Which are the qualities everyone look for.",5.0,Dell MS116 1000DPI USB Wired Optical Mouse
302,Good for office purpose....,No issues working fine...hassle free...good for long time use.,5.0,Dell MS116 1000DPI USB Wired Optical Mouse
303,Decent mouse,Preety decent mouse for everyday use,5.0,Dell MS116 1000DPI USB Wired Optical Mouse
304,Vair for money,Very nice product as always,4.0,Dell MS116 1000DPI USB Wired Optical Mouse
305,Faking Country of origin- Incorrect listing,"Incorrect listing as country of Origin India, but delivering a made in china product.",1.0,Dell MS116 1000DPI USB Wired Optical Mouse
306,DELL MS116 1000DPI USB OPTICAL MOUSE,"Nice mouse, this mouse comes with exact size in the sense that either not too much small nor big. Easy to hold, efficiency is good as well as a perfect mouse for gaming.",4.0,Dell MS116 1000DPI USB Wired Optical Mouse
307,Good,Original product,4.0,Dell MS116 1000DPI USB Wired Optical Mouse
308,Excellent product quality.... Great value for money,Very excellent product quality in this price range it's really Paisa Vasool must buy for daily rigid uses.....,5.0,Dell MS116 1000DPI USB Wired Optical Mouse
309,Its very nice And good with orginal Dell packaging,Its very nice And good with orginal Dell packaging I am very happy to saw this mouse awesome thanks to Amazon its very easy to trust this App,5.0,Dell MS116 1000DPI USB Wired Optical Mouse
310,Sturdy Product,Superb mouse very strong.Working well am using it for work daily 8 hours its working very well for me.,5.0,Dell MS116 1000DPI USB Wired Optical Mouse
311,Superb,Superb quality,5.0,Dell MS116 1000DPI USB Wired Optical Mouse
312,Comfortable,For basic use go for it. No gaming and design,5.0,Dell MS116 1000DPI USB Wired Optical Mouse
313,About Product,"I'm fully satisfied with product, the mouse is very smooth and fast and also it is cheaper than other products and come with 3 years warranty, this mouse is perfect go for it👍",5.0,Dell MS116 1000DPI USB Wired Optical Mouse
314,Go for it ! If you're not buying this product for gaming.,"Superb product.  Nice working,  I am writing reviews after 3 months , till now it working perfectly.  Satisfied with this product.  I am giving not 5 star because it is little uncomfortable for gaming.",4.0,Dell MS116 1000DPI USB Wired Optical Mouse
315,Compact and easy to hold,Cheap and best wired mouse I have found. I have been using this for gaming and found no issues.,5.0,Dell MS116 1000DPI USB Wired Optical Mouse
316,Best for regular task,This mouse is easy to hold and light weight and it is good for regular work. You can use in gaming but many new gaming mouse is available in market.,5.0,Dell MS116 1000DPI USB Wired Optical Mouse
317,A decent mouse,its a decent mouse felt it was a bit flat for my hand and didn't sit properly in my hand but works well. does what a mouse needs to do.,4.0,Dell MS116 1000DPI USB Wired Optical Mouse
318,don’t buy,scroll button is very loose and making noise.. product quality as well is very cheap.. just for name sake it is dell.. but it doesn’t feel like you are using a dell product.. not at all satisfied.. i wanna return this..,1.0,Dell MS116 1000DPI USB Wired Optical Mouse
319,Stop working after 5 month as normal use,after use of only 5 month stop working of scroll,1.0,Dell MS116 1000DPI USB Wired Optical Mouse
320,It's over all good for the price I paid (Rs~ 279/- ),It's over all good for the price I paid (Rs~ 279,5.0,Dell MS116 1000DPI USB Wired Optical Mouse
321,Good Value for money,This product is good for basic day to day usage.,5.0,Dell MS116 1000DPI USB Wired Optical Mouse
322,Donty buy these stop working after one week,After one week mouse stop working,1.0,Dell MS116 1000DPI USB Wired Optical Mouse
323,Good quality- solves the purpose,"Serves the purpose and seems to be good quality. For the price, it is a full value for money for day to day working",5.0,Dell MS116 1000DPI USB Wired Optical Mouse
324,A little small then expected,"Product material is good, however its little small than expected.  Hardly able to fit my apple earphones.",3.0,Dell MS116 1000DPI USB Wired Optical Mouse
325,Quick response time,Quick response time,5.0,Dell MS116 1000DPI USB Wired Optical Mouse
326,Qualify product,User friendly,5.0,Dell MS116 1000DPI USB Wired Optical Mouse
327,Best mouse... No any issue,Thanks amazon,5.0,Dell MS116 1000DPI USB Wired Optical Mouse
328,great product,product is of very good quality and feels good when using.,5.0,Dell MS116 1000DPI USB Wired Optical Mouse
329,Well enough,Big mouse for big hand ... Comfortable holding ...good product,5.0,Dell MS116 1000DPI USB Wired Optical Mouse
330,Good product,Good product,4.0,Dell MS116 1000DPI USB Wired Optical Mouse
331,Good,It's good...,4.0,Dell MS116 1000DPI USB Wired Optical Mouse
332,It just works,Works like you would expect a mouse to. Scrolling is smooth. Clicks are easy to make. Cursor movement is seamless.,5.0,Dell MS116 1000DPI USB Wired Optical Mouse
333,Good product.,Good product.,5.0,Dell MS116 1000DPI USB Wired Optical Mouse
334,Nice,Nice working from 2 week,5.0,Dell MS116 1000DPI USB Wired Optical Mouse
335,Left Click works as right click.,Mouse clicks gone wrong. Left click working as right click. Need serious testing to extend number of clicks. Dell needs serious UAT introspection.,1.0,Dell MS116 1000DPI USB Wired Optical Mouse
336,Trash...,Due to all the good reviews i went for it but its trash. Not for gaming at all.,1.0,Dell MS116 1000DPI USB Wired Optical Mouse
337,Fabulous,Easy to use.,5.0,Dell MS116 1000DPI USB Wired Optical Mouse
338,good for normal use but quality is just normal,good for normal use but quality is just normal,4.0,Dell MS116 1000DPI USB Wired Optical Mouse
339,Pathetuc,The mouse just wont move smoothly! It's a pain to get the cursor moving. Pathetic product.,1.0,Dell MS116 1000DPI USB Wired Optical Mouse
340,Go for it,If you have bedugt then purchase wireless mouse.This mouse is also good and sturdy,5.0,Dell MS116 1000DPI USB Wired Optical Mouse
341,Regular use only,Best for regular use,4.0,Dell MS116 1000DPI USB Wired Optical Mouse
342,About Dell mouse,Since it's Dell's mouse I don't have to tell u all about product quality . It's amazingOnly bad point is that it's a little big mouse to handle this mouse is good for those whose palm is quite big enough,5.0,Dell MS116 1000DPI USB Wired Optical Mouse
343,Value for money,"Good product, light weight and easy on pocket",5.0,Dell MS116 1000DPI USB Wired Optical Mouse
344,Perfect for WFH,"Been using this same mouse for over 2 years, then was so impressed by performance that ordered the same mouse. It is about the perfect weight, and amazing hand positioning.",5.0,Dell MS116 1000DPI USB Wired Optical Mouse
345,Thumbs up,A really good product for a budget.Buy it only if you are going to use it for simple work not editing or gaming.,5.0,Dell MS116 1000DPI USB Wired Optical Mouse
346,Don't buy it's too hard to operate,The left and right buttons are too hard and that it fits if your Pam is small...Made in china according to their pam dimensions... Pls don't buy,1.0,Dell MS116 1000DPI USB Wired Optical Mouse
347,The best.,"I have been using this mouse for about a month, it's very comfortable and performance is very good.Compared to HP this mouse is far better. No lags observed",5.0,Dell MS116 1000DPI USB Wired Optical Mouse
348,Good for day to day use,It's good for our office use. But not very good for gaming.,5.0,Dell MS116 1000DPI USB Wired Optical Mouse
349,5 star,This mouse is good for value for money and for work stuff onlyPlease dnt use as a gaming purposeOnly for work stuff5 star,5.0,Dell MS116 1000DPI USB Wired Optical Mouse
350,Excellent product,Very good mouse,5.0,Dell MS116 1000DPI USB Wired Optical Mouse
351,Great for the price I paid for it,It's comfortable to you use... It is for normal use not for gaming. Still you can. Play games using this mouse if you just play for fun or to burn time.,5.0,Dell MS116 1000DPI USB Wired Optical Mouse
352,Good,Good product,4.0,Dell MS116 1000DPI USB Wired Optical Mouse
353,Good product,Good product. I got this for my pc and have been using it for a few months now. No problem at all.,5.0,Dell MS116 1000DPI USB Wired Optical Mouse
354,Value for money mouse!,Value for money 1000 dpi mouse. But not very sharp as a 1600 dpi wireless Targa mouse. No battery required. Also comes with 3 years warranty!!,4.0,Dell MS116 1000DPI USB Wired Optical Mouse
355,SUBSTANDARD PRODUCT OF DELL MOUSE MODEL MS116,This is a substandard product MS116 DELL MOUSE the product was replaced immediately on delivery for non performance and now again I have problem with this model for not performing and not detected by my PC. this is a complain for  replacement of product being under 1 year warranty and bought on 3.8. 2019.,1.0,Dell MS116 1000DPI USB Wired Optical Mouse
356,China made product,Item is good but try to avoid selling chinese product. Better if you sell indian companies items which will give boost to our economy.,4.0,Dell MS116 1000DPI USB Wired Optical Mouse
357,No problems,"Product, packing, price and delivery as expected/promised.  No problems.",5.0,Dell MS116 1000DPI USB Wired Optical Mouse
358,Quality is too good👍,Just go for it. It's too good.,5.0,Dell MS116 1000DPI USB Wired Optical Mouse
359,Good,Good one,5.0,Dell MS116 1000DPI USB Wired Optical Mouse
360,Value for money,The mouse is ideal easy & comfortable. I am satisfied & liked it.,5.0,Dell MS116 1000DPI USB Wired Optical Mouse
361,"Over all a decent purchase , Go for it blindly",I hv been using it from past 15 days and mouse performance is magnificent...Good gripAll Buttons are working fine without any hasselJss go for it,4.0,Dell MS116 1000DPI USB Wired Optical Mouse
362,Mouse,Quality ok,4.0,Dell MS116 1000DPI USB Wired Optical Mouse
363,very good,very satisfied product delivered to me....... quality of mouse is very nice. comfortable to use.,5.0,Dell MS116 1000DPI USB Wired Optical Mouse
364,Quality product @ reasonable Rate,"Nice built quality its not like cheap plastic mouse which i was using. nice touch exact and precise, no accidental double click. Go for it.",5.0,Dell MS116 1000DPI USB Wired Optical Mouse
365,Superb mouse,It is compatible with all platformsEasy to holdVery smoothGood designPerfect mouse for every purpose,5.0,Dell MS116 1000DPI USB Wired Optical Mouse
366,Just Good,"The buttons are hard, not a smooth mouse, scroll wheel little bit hard to scroll.On an average is good for office use and all.",3.0,Dell MS116 1000DPI USB Wired Optical Mouse
367,Worth the price,Worth the price,5.0,Dell MS116 1000DPI USB Wired Optical Mouse
368,Best!,"Best!Yeah, the only word that comes to my mind. This product is awesome and it's price also!",5.0,Dell MS116 1000DPI USB Wired Optical Mouse
369,Good at it's price,Good and cheep,4.0,Dell MS116 1000DPI USB Wired Optical Mouse
370,Good For Work. Nice and simple. Easy to hold. Very Light weight,Good For Work. Nice and simple. Easy to hold. Very Light weight,4.0,Dell MS116 1000DPI USB Wired Optical Mouse
371,Very good mouse at affordable price,Very comfortable to work with and sturdy,5.0,Dell MS116 1000DPI USB Wired Optical Mouse
372,Best Mouse for drawing software uses..,I bought this mouse for drawing purpose and it's super good for that. Especially the mouse wheel design is so perfect for the drawing software use.,5.0,Dell MS116 1000DPI USB Wired Optical Mouse
373,Best Quality,Recommended..,5.0,Dell MS116 1000DPI USB Wired Optical Mouse
374,Comfortable,Amazing productEast to useVery comfortableOverall good with good price👌,5.0,Dell MS116 1000DPI USB Wired Optical Mouse
375,"Nice, value for money","Nice, value for money",4.0,Dell MS116 1000DPI USB Wired Optical Mouse
376,Good within this price range,"I'm using it for 3 days.So far,it's good to me. Won't tell it awesome but you can buy it. For gaming I have no idea but I think it's not good for very quick action.For normal activity I suggest to buy.",4.0,Dell MS116 1000DPI USB Wired Optical Mouse
377,Flimsy quality - clicks not registering,Left and right clicks not registering properly after 6 months of use,1.0,Dell MS116 1000DPI USB Wired Optical Mouse
378,Awesome in this price,Fast like rocket smooth like cream accurate like 3rd empire of match. GO like bullet train and purchase like kids choice.,5.0,Dell MS116 1000DPI USB Wired Optical Mouse
379,Very good,Good,5.0,Dell MS116 1000DPI USB Wired Optical Mouse
380,Perfect mouse for longer usage,Works perfectly. fits perfectly in hand and 1000 dpi movement is very precise.Perfect for long term usage.,5.0,Dell MS116 1000DPI USB Wired Optical Mouse
381,Excellent product,"Fantastic product - fits within the palm quite well, no stress on the fingers.",5.0,Dell MS116 1000DPI USB Wired Optical Mouse
382,Product is good,Product is very good. Using this for couple of days. Working smooth as of now.,5.0,Dell MS116 1000DPI USB Wired Optical Mouse
383,Very good Product.,Very good Product.,5.0,Dell MS116 1000DPI USB Wired Optical Mouse
384,Serves it's purpose,This product is compatible for all the company laptop and desktop. Works good and of light weight,5.0,Dell MS116 1000DPI USB Wired Optical Mouse
385,Good basic mouse.. Scroll wheel average,It's a good mouse but the scroll wheel is not precise due to slipping instead of ticking over when rolling.,4.0,Dell MS116 1000DPI USB Wired Optical Mouse
386,Amazing ... totally worth it,Nice cheap mouse and it the official mouse from dell.has got perfect weight balance and very comfortable grip.made of plastic but has the perfect weight to hold and use it.,5.0,Dell MS116 1000DPI USB Wired Optical Mouse
387,Good buy,"Simple, easy to use and sturdy. That's the best thing about this mouse. Just got another on Amazon for my daughter",5.0,Dell MS116 1000DPI USB Wired Optical Mouse
388,Exellect product with high online pricing,Best in market but online price for all computer peripheral is too high than local market. I bought this for 315/- but i get it for 280/-  same original product from local market,4.0,Dell MS116 1000DPI USB Wired Optical Mouse
389,Working,Working,5.0,Dell MS116 1000DPI USB Wired Optical Mouse
390,Good product,Simply the best.,5.0,Dell MS116 1000DPI USB Wired Optical Mouse
391,Good product,"Best, easily working with this .",5.0,Dell MS116 1000DPI USB Wired Optical Mouse
392,A good mouse for CPU,I find it very useful and the item was delivered in 18 hours at a remote place of Bangalore. Thanks.,5.0,Dell MS116 1000DPI USB Wired Optical Mouse
393,Item is awesome,Item delivered in good condition with perfectly packed condition👌,5.0,Dell MS116 1000DPI USB Wired Optical Mouse
394,Better mouse to buy.,Very sensitive mouse. Works fine. Ergonomic. Easy to hold.,5.0,Dell MS116 1000DPI USB Wired Optical Mouse
395,Excellent,Easy to hold and comfortable to use since for long hours your wrist does not pain. I love the scroller as well for a soft pad on it. With easy scrolling.,5.0,Dell MS116 1000DPI USB Wired Optical Mouse
396,Superb,Very good ordered it after my clg labs used this mouse. Very good clicks but not good for heavy gaming.,5.0,Dell MS116 1000DPI USB Wired Optical Mouse
397,Good,Good,4.0,Dell MS116 1000DPI USB Wired Optical Mouse
398,top quality product,top quality mouse in a reasonable rate..,5.0,Dell MS116 1000DPI USB Wired Optical Mouse
399,Functionally good,Functionall & most convenient to hold & to work on,5.0,Dell MS116 1000DPI USB Wired Optical Mouse
400,Great product by dell.,Great Product. Working perfectly fine. value for money.,5.0,Dell MS116 1000DPI USB Wired Optical Mouse
401,Best,"Easy to use, performance is good, best product in the market, Dell is best, I buy again & again, thanks for Amazon for the timely delivery such a good product.",5.0,Dell MS116 1000DPI USB Wired Optical Mouse
402,Awsome experience with Amazon,Excellent product.Worth for money.Amazon is trust worthyFast delivery,5.0,Dell MS116 1000DPI USB Wired Optical Mouse
403,An excellent option,"Very good quality mouse, easy to use and very smooth.",5.0,Dell MS116 1000DPI USB Wired Optical Mouse
404,Love the mouse size,Fed up with small sized mouse? This one fits well in the hand and works well too.,5.0,Dell MS116 1000DPI USB Wired Optical Mouse
405,Good mouse,Mouse is good.,5.0,Dell MS116 1000DPI USB Wired Optical Mouse
406,Decent product,Decent producyt as expected from Dell. Suitable for daily use and light gaming. Not recommended for gamers.,4.0,Dell MS116 1000DPI USB Wired Optical Mouse
407,"very bad, uncomfertable hard to push button.",its very bad hard to use and button are hard to push.,1.0,Dell MS116 1000DPI USB Wired Optical Mouse
408,"Reliable, Good Quality, Plug and play mouse for work from home setup.","Iam very happy with the performance of this mouse, its designed well and simple to use. Does what it is supposed to do. Definitely a value for money.",5.0,Dell MS116 1000DPI USB Wired Optical Mouse
409,Handy and safest,This mouse is based on usb wire cable so there's no headache of battery life..,3.0,Dell MS116 1000DPI USB Wired Optical Mouse
410,The mouse product,Very nice and amazing product it is very comfortable to hold and very comfortable to use. I am very thankful to have a awesome app called AMAZONThank you amazon,5.0,Dell MS116 1000DPI USB Wired Optical Mouse
411,Economical,Value for money,5.0,Dell MS116 1000DPI USB Wired Optical Mouse
412,Acha hai,Acha hai,5.0,Dell MS116 1000DPI USB Wired Optical Mouse
413,GOOD OPTICAL MOUSE FROM DELL,GOOD PRODUCT. WORTH THE MONEY.,5.0,Dell MS116 1000DPI USB Wired Optical Mouse
414,Little bit heavy weight on hand...,Heavy weight only problem.,4.0,Dell MS116 1000DPI USB Wired Optical Mouse
415,"Good Grip, Basic entry Level Mouse","Good for office work, Basic entry level mouse.The Grip is good. Quite economical also",5.0,Dell MS116 1000DPI USB Wired Optical Mouse
416,good quality and value for money,good quality and value for money,5.0,Dell MS116 1000DPI USB Wired Optical Mouse
417,Good product value for money,Good wired mouse if you are tight on budget i recommend to go for wireless,4.0,Dell MS116 1000DPI USB Wired Optical Mouse
418,Wire almost cut in half! Disappointed in Amazon.,"I had high hopes in Amazon, but im disappointed! They gave me a mouse whose wire was almost cut in half, common! You could have just given a good one, very disappointed.",1.0,Dell MS116 1000DPI USB Wired Optical Mouse
419,Good product,Pros:I prefer large size mouse as it is more comfortable working for long hours.Cons:Button click produces loud sound which I don't like.,3.0,Dell MS116 1000DPI USB Wired Optical Mouse
420,Fast delivery but product not durable,bought it a year ago after using it for 1 year the mouse has started showing up many clicking issues but a value for money product if you want to use it occasionally....,3.0,Dell MS116 1000DPI USB Wired Optical Mouse
421,Click is good,"Easy to hold, you can use it for gaming, it's rough and tough. I felt it was a good buy.",4.0,Dell MS116 1000DPI USB Wired Optical Mouse
422,Dell Mouse,Easy to hold and good for daily use,5.0,Dell MS116 1000DPI USB Wired Optical Mouse
423,Good product,Very handy mouse.esy to work with,5.0,Dell MS116 1000DPI USB Wired Optical Mouse
424,Good pick,The basic mouse for desktop/laptop.Size is large. I have large hands so I needed size of the mouse to be decent. Not recommended for gaming,4.0,Dell MS116 1000DPI USB Wired Optical Mouse
425,Any surface working,I like this mouse,5.0,Dell MS116 1000DPI USB Wired Optical Mouse
426,Budget Mouse,Very good for daily use,5.0,Dell MS116 1000DPI USB Wired Optical Mouse
427,Good quality,"Easy to hold , comfort on fingers , nice click feel",5.0,Dell MS116 1000DPI USB Wired Optical Mouse
428,Return policy,I want to return this product but it's only showing for replacement. Help me out,3.0,Dell MS116 1000DPI USB Wired Optical Mouse
429,"Nice, elegant and professional","Easy to hold, smooth particularly for office work not for professional gaming though..",5.0,Dell MS116 1000DPI USB Wired Optical Mouse
430,"crisp left and right clicks, scroller is also smooth",works smoothly and does not need any drivers to be installed. just plug and use,5.0,Dell MS116 1000DPI USB Wired Optical Mouse
431,Very smooth in operation,Sensitive mouse- high quality.,5.0,Dell MS116 1000DPI USB Wired Optical Mouse
432,100% nice product.,Recommended.,5.0,Dell MS116 1000DPI USB Wired Optical Mouse
433,not worth,its not working properly within 1 year of purchase even though handled with due care.,1.0,Dell MS116 1000DPI USB Wired Optical Mouse
434,Bestest mouse ever ....🔥💯🤘,"For studio, gaming , for every purposes... This mouse is legendary...🔥💯",5.0,Dell MS116 1000DPI USB Wired Optical Mouse
435,"product is robust, works well",found it good. No issues. Does the work of a mouse :D,5.0,Dell MS116 1000DPI USB Wired Optical Mouse
436,Good Mouse,This weight less and easy to you good value of money using from 1year 6months  good working,5.0,Dell MS116 1000DPI USB Wired Optical Mouse
437,Mouse,Best one from Dell,5.0,Dell MS116 1000DPI USB Wired Optical Mouse
438,So super product good performance,Good product & good performance value for money so good product sutiable for purposes,5.0,Dell MS116 1000DPI USB Wired Optical Mouse
439,Well,Good,4.0,Dell MS116 1000DPI USB Wired Optical Mouse
440,Not so good after one month of usage,"Initially, the mouse was working great, however, after one month of use, the scroll bar has been malfunctioning. Rest all is working fine.",2.0,Dell MS116 1000DPI USB Wired Optical Mouse
441,Handy mouse,"Good handy mouse. Easy to handle, quick plug & play",5.0,Dell MS116 1000DPI USB Wired Optical Mouse
442,Excellent,Excellent product. Works smoothly.,5.0,Dell MS116 1000DPI USB Wired Optical Mouse
443,very nice,i got it in 279,4.0,Dell MS116 1000DPI USB Wired Optical Mouse
444,Value for money,Value for money,4.0,Dell MS116 1000DPI USB Wired Optical Mouse
445,very good design and quality,this is the 5th piece i purchased for my friends. very much satisfied.,5.0,Dell MS116 1000DPI USB Wired Optical Mouse
446,Nice,It's grip is good!,5.0,Dell MS116 1000DPI USB Wired Optical Mouse
447,quality,"good grip,easily fits in one's hand,long cable,good built quality.the only problem is that the point where cable goes into the mouse,there is no rubber type part which prevents cable from cracking....but still this mouse is value for money...",4.0,Dell MS116 1000DPI USB Wired Optical Mouse
448,Perfect,I have been using this work like 10hrs or more. It works fine no problem faced so far. I ve been using it for weeks now.,5.0,Dell MS116 1000DPI USB Wired Optical Mouse
449,light in weight and awesome mouse,"this mouse is amazing because it is nice in design and grip, if you are looking for mouse for around 300 then believe me you will not get a better option than this, just go for it ..also mazon delivered this product very nicely overall good experience",5.0,Dell MS116 1000DPI USB Wired Optical Mouse
450,Does it's job!,This is basic mouse with good ergonomics and sensitivity!,5.0,Dell MS116 1000DPI USB Wired Optical Mouse
451,So far so good,Haven't used it for gaming so far.  So no idea about that,5.0,Dell MS116 1000DPI USB Wired Optical Mouse
452,Excellent Packaging.,Slightly disappointed with click button Quality and it's original sound. Otherwise all are good.,4.0,Dell MS116 1000DPI USB Wired Optical Mouse
453,Waste of money,Not so good mouse got button damaged in 3 months. No official support from Dell or Amazon don't buy this product.,2.0,Dell MS116 1000DPI USB Wired Optical Mouse
454,Value for money,"I've used it only for a couple of days, but I love it. Easy to use and simple and elegant design",5.0,Dell MS116 1000DPI USB Wired Optical Mouse
455,Nice product,Nice product,5.0,Dell MS116 1000DPI USB Wired Optical Mouse
456,Best mouse in this price range,Best build quality and beautiful experience. High sensitivity and superb experience makes it the best mouse at this price range.,5.0,Dell MS116 1000DPI USB Wired Optical Mouse
